{
  "text": "Young Chinese woman in red Hanfu, intricate embroidery. Impeccable makeup, red floral forehead pattern. Elaborate high bun, golden phoenix headdress, red flowers, beads. Holds round folding fan with lady, trees, bird. Neon lightning-bolt lamp (⚡️), bright yellow glow, above extended left palm. Soft-lit outdoor night background, silhouetted tiered pagoda (西安大雁塔), blurred colorful distant lights.",
  "description": "Woman in red Hanfu with phoenix headdress, neon accent, pagoda night background",
  "intended_model": "z-image",
  "tags": [
    "portrait",
    "hanfu",
    "night"
  ]
}
